{"$schema":"schemas/production-release-authority-policy.schema.json","schema_version":"openadapt.production-release-authority-policy/v1","release_app":{"app_id":"4730708","app_slug":"openadapt-release","installation_id":"156835568","bot_user_id":"321543906","bot_login":"openadapt-release[bot]"},"repository_selection":"selected","permissions":{"administration":"read","contents":"write","metadata":"read"},"repositories":[{"target":"agent","repository":"OpenAdaptAI/OpenAdapt","repository_id":"627024850","package_path":"packages/agent","tag_pattern":"refs/tags/openadapt-agent-v*","creation_ruleset":"OpenAdapt policy: openadapt-agent release tag creation","immutability_ruleset":"OpenAdapt policy: immutable openadapt-agent release tags"},{"target":"capture","repository":"OpenAdaptAI/openadapt-capture","repository_id":"1115283835"},{"target":"cloud","repository":"OpenAdaptAI/openadapt-cloud","repository_id":"1300570990"},{"target":"desktop","repository":"OpenAdaptAI/openadapt-desktop","repository_id":"1171291730"},{"target":"docs","repository":"OpenAdaptAI/openadapt-ops","repository_id":"1172011294"},{"target":"flow","repository":"OpenAdaptAI/OpenAdapt","repository_id":"627024850","package_path":"packages/flow","tag_pattern":"refs/tags/openadapt-flow-v*","creation_ruleset":"OpenAdapt policy: openadapt-flow release tag creation","immutability_ruleset":"OpenAdapt policy: immutable openadapt-flow release tags"},{"target":"openadapt","repository":"OpenAdaptAI/OpenAdapt","repository_id":"627024850"}],"tag_rulesets":{"creation_authority":"OpenAdapt policy: release tag creation","immutability":"OpenAdapt policy: immutable release tags"},"support_release_authorities":[{"id":"desktop-managed-ffmpeg-runtime","lifecycle":"Support","repository":"OpenAdaptAI/openadapt-desktop","repository_id":"1171291730","tag_pattern":"refs/tags/ffmpeg-runtime-v*","creation_ruleset":"OpenAdapt policy: FFmpeg runtime tag creation","immutability_ruleset":"OpenAdapt policy: immutable FFmpeg runtime tags"}]}
